{
  "version": 2,
  "note": "RimPLC ladder (v2). \"i think this is the whoole PLC like logic chain if this then this if heath level reaches then this type of thing for the whole game properly layed out into a PLC that we will call RimPLC\" -- laid out as a PLC: `sensors` are the measured inputs (gates.py derive(); a key it cannot read is left out and the rung stays quiet), `tags` are constants (owner-only safety limits) and variables (setpoints recomputed each scan, clamped, overridable with ladder_set tag), `marks` are what she records herself with ladder_set mark (booleans or numbers), and `gates` are the rungs: when (an AND over sensors, marks and tags; ops = exact, <, >, <=, >=, !=) -> then (an ordered action chain). Lower priority fires first; only the first live rung plus `always` is handed over. A rung with latch:true gets mark_<id>_done:false in its when and sets it as its last step, so a finished growth rung never hides the rungs after it. Rungs at GRACE_FROM_PRIORITY and above (except always) wait until day > START_GRACE_DAYS. Anything marked UNVERIFIED in a note has not been seen in a captured bridge reply or the mod's wiki. Control chains (owner decision 3, docs/RIMPLC_DESIGN.md): rungs with a `chain` field (combat, medical, repairs, defense, supply) are wired like relays -- each rung's last steps set a mark that is the next rung's input, a reset rung drops the latch when the condition clears; every chain rung is `mode: advise` and carries `check` (the question it answers) and `notice` (a one-line message for a human).",
  "sensors": {
    "ticks_moving": {
      "source": "get_game_info.ticksGame read twice 1.2 s apart",
      "type": "bool"
    },
    "day": {
      "source": "get_game_info.ticksGame / 60000",
      "type": "float"
    },
    "quadrum_index": {
      "source": "floor(ticksGame / 900000) % 4",
      "type": "int",
      "note": "a counter, NOT a season: the season depends on latitude (UNVERIFIED as a season)"
    },
    "paused": {
      "source": "state.paused on bridge replies (captured on list_zones)",
      "type": "bool"
    },
    "map_count": {
      "source": "get_game_info.mapCount",
      "type": "int"
    },
    "dialog_open": {
      "source": "get_ui_state.nonImmediateDialogWindowOpen",
      "type": "bool"
    },
    "letters": {
      "source": "list_letters, ids not yet in ladder.json letters_seen",
      "type": "int"
    },
    "threat_letter": {
      "source": "list_letters letterDef in ThreatBig/ThreatSmall, ageTicks <= 2 days",
      "type": "bool",
      "note": "def names from decompiled vanilla (LetterDefOf); only PositiveEvent captured live"
    },
    "quest_letter": {
      "source": "unseen letter, 'quest' in label or 'Quest' in letterDef",
      "type": "bool",
      "note": "UNVERIFIED def name"
    },
    "empire_letter": {
      "source": "unseen letter, 'empire' in relatedFaction",
      "type": "bool",
      "note": "UNVERIFIED: relatedFaction is the faction's NAME"
    },
    "alert_<x>": {
      "source": "list_alerts alerts[].label substring (gates.ALERT_MATCH)",
      "type": "bool",
      "note": "UNVERIFIED labels: no list_alerts reply captured; labels logged to scratch/alert_labels.json"
    },
    "colonists": {
      "source": "list_colonists, factionIsPlayer and humanlike",
      "type": "int"
    },
    "downed_count": {
      "source": "list_colonists downed",
      "type": "int"
    },
    "drafted_count": {
      "source": "list_colonists drafted",
      "type": "int"
    },
    "mental_break": {
      "source": "list_colonists mentalState not null",
      "type": "bool"
    },
    "away_maps": {
      "source": "distinct mapId among crew - 1",
      "type": "int"
    },
    "colony_animals": {
      "source": "list_colonists animal and factionIsPlayer",
      "type": "int",
      "note": "UNVERIFIED that the list holds animals: written only when > 0"
    },
    "colony_mechs": {
      "source": "list_colonists mechanoid and factionIsPlayer",
      "type": "int",
      "note": "UNVERIFIED, written only when > 0"
    },
    "hostile_pawns_listed": {
      "source": "list_colonists factionHostileToPlayer, not dead/downed",
      "type": "int",
      "note": "field captured; UNVERIFIED that hostiles are listed: written only when > 0"
    },
    "home_on_screen": {
      "source": "list_colonists currentMapOnly holds the home map",
      "type": "bool"
    },
    "growing_cells": {
      "source": "list_zones Zone_Growing cellCount sum",
      "type": "int"
    },
    "stockpile_cells": {
      "source": "list_zones Zone_Stockpile cellCount sum",
      "type": "int"
    },
    "food_store": {
      "source": "a zone label contains 'food'",
      "type": "bool"
    },
    "main_store": {
      "source": "a zone label contains 'main'",
      "type": "bool"
    },
    "home_cells": {
      "source": "list_areas Area_Home cellCount (or a swept cell's areas[])",
      "type": "int"
    },
    "colony_exists": {
      "source": "any crew",
      "type": "bool"
    },
    "explore_done": {
      "source": ".local/qa/_explore_done.flag",
      "type": "bool"
    },
    "game_foreground": {
      "source": "Win32 foreground window",
      "type": "bool"
    },
    "meals": {
      "source": "sweep (get_cells_info over the camp rect, home on screen only): defName Meal*",
      "type": "int"
    },
    "raw_food": {
      "source": "sweep (get_cells_info over the camp rect, home on screen only): defName Raw*",
      "type": "int"
    },
    "wood": {
      "source": "sweep (get_cells_info over the camp rect, home on screen only): WoodLog",
      "type": "int"
    },
    "medicine": {
      "source": "sweep (get_cells_info over the camp rect, home on screen only): defName contains Medicine",
      "type": "int"
    },
    "days_of_food": {
      "source": "sweep (get_cells_info over the camp rect, home on screen only): (meals*0.9 + raw*0.05) / (1.6 * crew)",
      "type": "float"
    },
    "blueprints": {
      "source": "sweep (get_cells_info over the camp rect, home on screen only): blueprintBuildDefs",
      "type": "int"
    },
    "humanlikes_not_ours": {
      "source": "sweep (get_cells_info over the camp rect, home on screen only): pawn label with ', title' not in crew",
      "type": "int"
    },
    "hostiles_on_map": {
      "source": "humanlikes_not_ours while threat_letter, or hostile_pawns_listed",
      "type": "int"
    },
    "has_power": {
      "source": "sweep (get_cells_info over the camp rect, home on screen only): a generator or Battery",
      "type": "bool"
    },
    "defences_built": {
      "source": "sweep (get_cells_info over the camp rect, home on screen only): turret, Sandbags, Barricade or Embrasure",
      "type": "bool"
    },
    "store_roofed_fraction": {
      "source": "sweep (get_cells_info over the camp rect, home on screen only): food/main stockpile cells with roofDefName",
      "type": "float"
    },
    "unroofed_store_cells": {
      "source": "sweep (get_cells_info over the camp rect, home on screen only): food/main stockpile cells without a roof",
      "type": "int"
    },
    "steel": {
      "source": "sweep (get_cells_info over the camp rect, home on screen only): Steel x stackCount",
      "type": "int",
      "note": "stackCount UNVERIFIED in captures (1 per stack otherwise)"
    },
    "components": {
      "source": "sweep (get_cells_info over the camp rect, home on screen only): ComponentIndustrial",
      "type": "int",
      "note": "stackCount UNVERIFIED"
    },
    "adv_components": {
      "source": "sweep (get_cells_info over the camp rect, home on screen only): ComponentSpacer",
      "type": "int",
      "note": "stackCount UNVERIFIED"
    },
    "plasteel": {
      "source": "sweep (get_cells_info over the camp rect, home on screen only): Plasteel",
      "type": "int",
      "note": "defName UNVERIFIED in captures"
    },
    "uranium": {
      "source": "sweep (get_cells_info over the camp rect, home on screen only): Uranium",
      "type": "int",
      "note": "defName UNVERIFIED in captures"
    },
    "gold": {
      "source": "sweep (get_cells_info over the camp rect, home on screen only): Gold",
      "type": "int",
      "note": "defName UNVERIFIED in captures"
    },
    "silver": {
      "source": "sweep (get_cells_info over the camp rect, home on screen only): Silver",
      "type": "int",
      "note": "defName UNVERIFIED in captures"
    },
    "chemfuel": {
      "source": "sweep (get_cells_info over the camp rect, home on screen only): Chemfuel",
      "type": "int",
      "note": "defName UNVERIFIED in captures"
    },
    "cloth": {
      "source": "sweep (get_cells_info over the camp rect, home on screen only): Cloth + Leather_*",
      "type": "int",
      "note": "Leather_* captured; Cloth UNVERIFIED"
    },
    "berry_bushes": {
      "source": "sweep (get_cells_info over the camp rect, home on screen only): Plant_Berry, Plant_Strawberry_Wild",
      "type": "int",
      "note": "Plant_Strawberry_Wild captured; Plant_Berry UNVERIFIED"
    },
    "healroot_plants": {
      "source": "sweep (get_cells_info over the camp rect, home on screen only): Plant_Healroot, Plant_HealrootWild",
      "type": "int"
    },
    "wild_game": {
      "source": "sweep (get_cells_info over the camp rect, home on screen only): non-human pawn without ', title', not NEVER_HUNT, minus colony_animals",
      "type": "int",
      "note": "tamed and wild animals look the same in cell data"
    },
    "danger_animals_near": {
      "source": "sweep (get_cells_info over the camp rect, home on screen only): pawn defName Boomalope/Thrumbo/Elephant/Rhinoceros/Megasloth/Bear_*",
      "type": "int",
      "note": "defNames UNVERIFIED in captures"
    },
    "mount_candidates": {
      "source": "sweep (get_cells_info over the camp rect, home on screen only): pawn defName in MOUNT_DEFS",
      "type": "int",
      "note": "defNames UNVERIFIED in captures"
    },
    "designations_hunt": {